{
  "scenario_id": "chronic_pancreatitis_01",
  "category": "만성복통/소화불량",
  "hidden_diagnosis": "만성 췌장염",

  "patient": {
    "name": "강현수",
    "age": 45,
    "gender": "남",
    "address": "인천시 미추홀구",
    "vital_signs": {
      "BP": "126/80",
      "PR": 80,
      "RR": 16,
      "BT": 36.8,
      "SpO2": 98
    },
    "appearance": "[다소 수척해 보이는 중년 남성. 상복부 쪽이 불편한 듯 약간 앞으로 구부린 자세로 앉아있음]"
  },

  "chief_complaint": {
    "initial_response": "배가 자꾸 아파요. 명치랑 등 쪽이요. 몇 달 됐는데 계속 이러네요.",
    "volunteered_extras": [
      "술 마시고 나면 특히 더 심해지는 것 같아요"
    ]
  },

  "history": {
    "O_onset": {
      "when": "정확히는 모르겠는데 한 6개월 전부터인 것 같아요",
      "how": "서서히",
      "situation": "처음엔 그냥 술 마시고 체한 줄 알았는데 점점 자주 그래요"
    },
    "L_location": {
      "primary": "[명치와 왼쪽 상복부를 가리키며] 여기 명치 쪽이요",
      "radiation": "등 쪽으로 퍼지는 것 같아요. 허리 뒤쪽이요",
      "migration": "처음부터 여기 위쪽이었어요"
    },
    "D_duration": {
      "frequency": "일주일에 두세 번은 아픈 것 같아요",
      "duration_each": "한번 시작하면 몇 시간씩 가요",
      "pattern": "음주 후에 주로 생기는 것 같아요"
    },
    "Co_course": {
      "progression": "점점 심해짐"
    },
    "Ex_experience": {
      "previous_episode": true,
      "previous_detail": "2년 전에 췌장염이라고 입원한 적 있어요. 그때도 술 마시고 그랬거든요"
    },
    "C_character": {
      "quality": "찌르는 것 같이 심하게 아파요. 등까지 뻗치는 느낌이요",
      "nrs": 6
    },
    "A_associated": {
      "emergency": {
        "palpitation": false,
        "dyspnea": false,
        "dizziness": false,
        "decreased_urine": false
      },
      "systemic": {
        "fever": false,
        "chills": false,
        "fatigue": true,
        "fatigue_response": "요즘 많이 피곤해요",
        "weight_loss": true,
        "weight_loss_response": "살이 많이 빠졌어요. 6개월 동안 7~8kg 빠진 것 같아요. 밥을 잘 못 먹겠어요",
        "night_sweats": false
      },
      "GI": {
        "anorexia": true,
        "anorexia_response": "밥맛이 없어요. 먹으면 더 아플까봐 겁나기도 하고",
        "nausea": true,
        "nausea_response": "메스껍기도 해요",
        "vomiting": true,
        "vomiting_response": "심할 때는 토하기도 해요",
        "diarrhea": true,
        "diarrhea_response": "설사를 자주 해요. 변이 기름지게 나오는 것 같기도 하고",
        "constipation": false,
        "hematemesis": false,
        "melena": false,
        "hematochezia": false,
        "bloating": false,
        "jaundice": false,
        "fatty_stool": true,
        "fatty_stool_response": "변이 좀 기름지게 나오고 냄새가 심한 것 같아요. 변기에 기름 같은 게 뜨는 것 같기도 하고요"
      },
      "urinary": {
        "dysuria": false,
        "hematuria": false,
        "frequency": false
      }
    },
    "F_factor": {
      "aggravating": ["음주 후", "기름진 음식 먹을 때", "과식"],
      "aggravating_response": "술 마시면 거의 무조건 아파요. 기름진 거 먹어도 심해지고, 과식하면 더 나빠요",
      "relieving": ["앞으로 구부리면", "제산제"],
      "relieving_response": "이렇게 앞으로 구부리면 좀 덜 아픈 것 같아요. 제산제 먹어봤는데 그건 별로 안 들어요",
      "posture_effect": "앞으로 구부리면 좀 나아요. 똑바로 누우면 더 아픈 것 같아요"
    }
  },

  "social_history": {
    "alcohol": {
      "drinks": true,
      "amount": "소주 한 병에서 두 병, 거의 매일 마셔요. 20년 됐어요",
      "recent_binge": true,
      "recent_binge_response": "어제도 마셨어요"
    },
    "smoking": {
      "smokes": true,
      "amount": "하루 한 갑, 20년이요"
    },
    "diet": "식사가 불규칙해요. 기름진 음식 즐겨 먹고 안주 자주 먹어요",
    "recent_food": "어제 삼겹살에 술 마셨어요",
    "occupation": "화물차 운전 기사예요",
    "exercise": "못 해요",
    "stress": "직업 특성상 스트레스 많아요",
    "travel": "없어요"
  },

  "past_medical_history": {
    "conditions": ["급성 췌장염 (2년 전 입원)"],
    "conditions_response": "2년 전에 급성 췌장염으로 일주일 입원했어요. 그때 술 때문이라고 했어요",
    "surgeries": [],
    "surgeries_response": "수술은 없어요",
    "medications": ["진통제 (가끔 약국에서 구매)"],
    "medications_response": "배 아플 때 약국에서 진통제 사 먹어요",
    "allergies": "없어요",
    "vaccinations": {
      "hep_A": false,
      "hep_B": false,
      "hep_B_response": "예방접종은 잘 안 챙긴 것 같아요"
    },
    "health_checkup": "건강검진은 잘 안 받았어요, 몇 년째"
  },

  "family_history": {
    "relevant": ["아버지 간경화"],
    "response": "아버지도 술 드셔서 간경화 있으세요"
  },

  "physical_exam": {
    "general": "약간 수척해 보임. 만성 병색",
    "eyes": "결막 창백 경미, 공막 황달 없음",
    "mouth": "구강 건조 경미",
    "lymph_nodes": "촉지 안 됨",
    "abdomen": {
      "inspection": "특이소견 없음",
      "auscultation": "장음 정상",
      "percussion": "특이소견 없음",
      "palpation": "상복부 압통 있음. 특히 명치 및 좌상복부. 반동 압통 없음",
      "tenderness_location": "상복부, 명치 중심",
      "rebound_tenderness": false,
      "guarding": false,
      "murphy_sign": false,
      "rovsing_sign": false,
      "mcburney_point": false,
      "obturator_sign": false,
      "psoas_sign": false,
      "CVAT": false
    },
    "DRE": "특이소견 없음"
  },

  "nonverbal_expressions": {
    "on_entry": "[수척한 모습으로 약간 앞으로 구부린 채 들어옴]",
    "on_pain_question": "[명치를 가리키며 등 쪽을 함께 가리킴] 여기랑 등 뒤가 아파요",
    "on_alcohol_question": "[머뭇거리다가] 네... 많이 마시는 편이에요",
    "on_weight_loss_mention": "[걱정스러운 표정] 그러게요. 많이 빠진 것 같아요",
    "on_fatty_stool_question": "[약간 당황한 표정] 그게 이상한 건가요? 변이 좀 기름지게 나오긴 해요",
    "on_bad_news": "[표정이 굳으며] 술을 꼭 끊어야 하나요?",
    "baseline_emotion": "무관심"
  },

  "unknown_responses": {
    "default_unknown": "글쎄요, 모르겠어요.",
    "specific_unknowns": [
      {
        "question_pattern": "당뇨",
        "response": "당뇨는 없다고 했는데... 최근에 검사는 안 해봤어요"
      },
      {
        "question_pattern": "황달",
        "response": "눈이 노랗게 된 적은 없었어요"
      }
    ]
  },

  "scoring": {
    "rapport_checklist": [
      {
        "item": "인사 및 자기소개",
        "keywords": ["안녕하세요", "학생의사", "저는"],
        "score": 2
      },
      {
        "item": "진료 시간 및 동의 안내",
        "keywords": ["분 동안", "괜찮으시겠어요"],
        "score": 2
      },
      {
        "item": "불편 시 말씀해달라 안내",
        "keywords": ["불편", "말씀해주세요"],
        "score": 1
      },
      {
        "item": "환자 편의 배려",
        "keywords": ["오시는 길", "날씨"],
        "score": 1
      }
    ],
    "history_checklist": [
      {
        "category": "L - 등으로 방사 (핵심!)",
        "question_example": "통증이 등 쪽으로 퍼지나요?",
        "keywords": ["등", "퍼지", "방사", "뻗침"],
        "score": 5,
        "required": true
      },
      {
        "category": "F - 음주 후 악화 (핵심!)",
        "question_example": "술 마시면 더 심해지나요?",
        "keywords": ["술", "음주", "마시면"],
        "score": 5,
        "required": true
      },
      {
        "category": "F - 제산제 무효 (핵심!)",
        "question_example": "제산제 먹어보셨나요? 효과가 있었나요?",
        "keywords": ["제산제", "효과", "들었나"],
        "score": 4,
        "required": true
      },
      {
        "category": "F - 앞으로 굽히면 완화",
        "question_example": "자세에 따라 다르신가요?",
        "keywords": ["자세", "굽히", "앞으로"],
        "score": 3,
        "required": true
      },
      {
        "category": "A - 지방변 (핵심!)",
        "question_example": "변이 기름지게 나오거나 냄새가 심하지 않나요?",
        "keywords": ["지방변", "기름", "냄새", "변기"],
        "score": 5,
        "required": true
      },
      {
        "category": "A - 체중감소",
        "question_example": "체중이 줄었나요?",
        "keywords": ["체중", "살", "빠졌"],
        "score": 3,
        "required": true
      },
      {
        "category": "사회력 - 음주 (핵심!)",
        "question_example": "술을 드시나요? 얼마나?",
        "keywords": ["술", "음주", "얼마나"],
        "score": 5,
        "required": true
      },
      {
        "category": "과거력 - 급성 췌장염",
        "question_example": "예전에도 이런 적 있으셨나요?",
        "keywords": ["예전", "이전", "전에도"],
        "score": 3,
        "required": true
      },
      {
        "category": "F - 기름진 음식 악화",
        "question_example": "기름진 음식 드시면 더 아프세요?",
        "keywords": ["기름진", "지방", "기름"],
        "score": 3,
        "required": false
      }
    ],
    "exam_checklist": [
      {
        "item": "복부 촉진 (상복부 압통)",
        "keywords": ["촉진", "눌러", "압통"],
        "score": 3,
        "required": true
      },
      {
        "item": "복부 청진",
        "keywords": ["청진", "장음"],
        "score": 2,
        "required": true
      }
    ],
    "diagnosis_score": {
      "correct_keywords": ["만성 췌장염", "췌장염", "chronic pancreatitis"],
      "score": 10
    },
    "treatment_plan_score": {
      "required_workup": ["복부 초음파", "CT", "MRI", "내시경역행담췌관조영", "ERCP"],
      "required_treatment": ["금주", "금연", "췌장효소 보충", "식이조절", "통증조절", "저지방식"],
      "score": 10
    },
    "total_score": 67
  }
}
